{
  "$schema": "factory/registry/schema/component_registry.schema.json",
  "registry_id": "application-factory-component-registry",
  "registry_schema_version": "1.0.0",
  "conventions": {
    "canonical_source": "factory/registry/component_registry.json",
    "identity": "component_id is the stable, unique, deterministic component identity; snake_case, never reused, never a floating selector",
    "versioning": "public component version is explicit SemVer MAJOR.MINOR.PATCH (ARCHITECTURE.md §11); floating selectors (latest/current/default/stable) are never accepted",
    "ownership": "owner records the accountable party; data_ownership.owner records the component that owns the data (ARCHITECTURE.md LAW-03). The registry owns no business data (ADR-0015 §4, §11)",
    "artifacts": "ARCHITECTURE.md §11 requires id + version + digest for a supplied artifact. No deployable artifact is published at Level 0, so every entry records artifact_type=none, digest=null, pinned=false (ARCHITECTURE.md §30; CONFORMANCE_REVIEW_1.2.0 DOD-02)",
    "lifecycle": "registry_state=registered records that the entry exists in the canonical registry. It certifies nothing: a registered component is not by that fact deployable or publishable (ARCHITECTURE.md §30)",
    "dependencies": "declared component-to-component dependencies carry an explicit version range; discovery never uses internal imports or internal database access (ARCHITECTURE.md §18)"
  },
  "components": [
    {
      "component_id": "authorization",
      "component_version": "0.1.0",
      "class": "platform_service",
      "maturity_level": "level_0_modular_monolith",
      "scs_id": null,
      "owner": "@Kvasha62",
      "owner_source": ".github/CODEOWNERS",
      "contracts": {
        "component_contract": "components/authorization/contract/component_contract.json",
        "openapi": "components/authorization/contract/openapi.yaml"
      },
      "data_ownership": {
        "owner": "authorization",
        "logical_schema": "authorization",
        "data_scopes": [
          "platform-scoped",
          "tenant-scoped"
        ],
        "datasets": [
          {
            "name": "permission_grants",
            "scope": "tenant-scoped"
          },
          {
            "name": "service_access",
            "scope": "platform-scoped"
          },
          {
            "name": "audit_events",
            "scope": "platform-scoped"
          }
        ],
        "source": "components/authorization/contract/component_contract.json#/data_ownership"
      },
      "dependencies": [
        {
          "component_id": "identity",
          "version_range": ">=0.3.0,<0.4.0",
          "kind": "api",
          "contract": "components/identity/contract/component_contract.json"
        },
        {
          "component_id": "tenant_authority",
          "version_range": ">=0.1.0,<0.2.0",
          "kind": "api",
          "contract": "components/tenant_authority/contract/component_contract.json"
        }
      ],
      "compatibility": {
        "api_policy": "additive-minor-breaking-major",
        "event_policy": "tolerant-reader",
        "supported_api_majors": 1,
        "breaking_change_requires": "major_version",
        "source": "components/authorization/contract/component_contract.json#/compatibility_policy"
      },
      "artifact": {
        "artifact_type": "none",
        "digest": null,
        "pinned": false,
        "canonical_form": null
      },
      "lifecycle": {
        "registry_state": "registered",
        "deployable": false,
        "publishable": false,
        "publishability_blockers": [
          "deployment_artifact_absent",
          "migrations_absent"
        ]
      }
    },
    {
      "component_id": "identity",
      "component_version": "0.3.1",
      "class": "platform_service",
      "maturity_level": "level_0_modular_monolith",
      "scs_id": null,
      "owner": "@Kvasha62",
      "owner_source": ".github/CODEOWNERS",
      "contracts": {
        "component_contract": "components/identity/contract/component_contract.json",
        "openapi": "components/identity/contract/openapi.yaml"
      },
      "data_ownership": {
        "owner": "identity",
        "logical_schema": "identity",
        "data_scopes": [
          "platform-scoped",
          "tenant-scoped"
        ],
        "datasets": [
          {
            "name": "identities",
            "scope": "platform-scoped"
          },
          {
            "name": "tenant_associations",
            "scope": "tenant-scoped"
          },
          {
            "name": "protected_records",
            "scope": "tenant-scoped"
          },
          {
            "name": "audit_events",
            "scope": "platform-scoped"
          }
        ],
        "source": "components/identity/contract/component_contract.json#/data_ownership"
      },
      "dependencies": [
        {
          "component_id": "tenant_authority",
          "version_range": ">=0.1.0,<0.2.0",
          "kind": "api",
          "contract": "components/tenant_authority/contract/component_contract.json"
        }
      ],
      "compatibility": {
        "api_policy": "additive-minor-breaking-major",
        "event_policy": "tolerant-reader",
        "supported_api_majors": 1,
        "breaking_change_requires": "major_version",
        "source": "components/identity/contract/component_contract.json#/compatibility_policy"
      },
      "artifact": {
        "artifact_type": "none",
        "digest": null,
        "pinned": false,
        "canonical_form": null
      },
      "lifecycle": {
        "registry_state": "registered",
        "deployable": false,
        "publishable": false,
        "publishability_blockers": [
          "deployment_artifact_absent",
          "migrations_absent"
        ]
      }
    },
    {
      "component_id": "tenant_authority",
      "component_version": "0.1.0",
      "class": "platform_service",
      "maturity_level": "level_0_modular_monolith",
      "scs_id": null,
      "owner": "@Kvasha62",
      "owner_source": ".github/CODEOWNERS",
      "contracts": {
        "component_contract": "components/tenant_authority/contract/component_contract.json",
        "openapi": "components/tenant_authority/contract/openapi.yaml"
      },
      "data_ownership": {
        "owner": "tenant_authority",
        "logical_schema": "tenant_authority",
        "data_scopes": [
          "platform-scoped"
        ],
        "datasets": [
          {
            "name": "tenant_registry",
            "scope": "platform-scoped"
          },
          {
            "name": "lifecycle_transitions",
            "scope": "platform-scoped"
          },
          {
            "name": "service_access",
            "scope": "platform-scoped"
          },
          {
            "name": "audit_events",
            "scope": "platform-scoped"
          },
          {
            "name": "idempotency_keys",
            "scope": "platform-scoped"
          }
        ],
        "source": "components/tenant_authority/contract/component_contract.json#/data_ownership"
      },
      "dependencies": [],
      "compatibility": {
        "api_policy": "additive-minor-breaking-major",
        "event_policy": "tolerant-reader",
        "supported_api_majors": 1,
        "breaking_change_requires": "major_version",
        "source": "components/tenant_authority/contract/component_contract.json#/compatibility_policy"
      },
      "artifact": {
        "artifact_type": "none",
        "digest": null,
        "pinned": false,
        "canonical_form": null
      },
      "lifecycle": {
        "registry_state": "registered",
        "deployable": false,
        "publishable": false,
        "publishability_blockers": [
          "deployment_artifact_absent",
          "migrations_absent"
        ]
      }
    },
    {
      "component_id": "records",
      "component_version": "0.1.0",
      "class": "platform_service",
      "maturity_level": "level_0_modular_monolith",
      "scs_id": null,
      "owner": "@Kvasha62",
      "owner_source": ".github/CODEOWNERS",
      "contracts": {
        "component_contract": "components/records/contract/component_contract.json",
        "openapi": "components/records/contract/openapi.yaml"
      },
      "data_ownership": {
        "owner": "records",
        "logical_schema": "records",
        "data_scopes": [
          "platform-scoped",
          "tenant-scoped"
        ],
        "datasets": [
          {
            "name": "resources",
            "scope": "tenant-scoped"
          },
          {
            "name": "access_audit",
            "scope": "platform-scoped"
          }
        ],
        "source": "components/records/contract/component_contract.json#/data_ownership"
      },
      "dependencies": [
        {
          "component_id": "authorization",
          "version_range": ">=0.1.0,<0.2.0",
          "kind": "api",
          "contract": "components/authorization/contract/component_contract.json"
        }
      ],
      "compatibility": {
        "api_policy": "additive-minor-breaking-major",
        "event_policy": "tolerant-reader",
        "supported_api_majors": 1,
        "breaking_change_requires": "major_version",
        "source": "components/records/contract/component_contract.json#/compatibility_policy"
      },
      "artifact": {
        "artifact_type": "none",
        "digest": null,
        "pinned": false,
        "canonical_form": null
      },
      "lifecycle": {
        "registry_state": "registered",
        "deployable": false,
        "publishable": false,
        "publishability_blockers": [
          "deployment_artifact_absent",
          "migrations_absent"
        ]
      }
    },
    {
      "component_id": "learning",
      "component_version": "0.3.0",
      "class": "business_system",
      "maturity_level": "level_0_modular_monolith",
      "scs_id": "SCS-001",
      "owner": "@Kvasha62",